{
  "profile_id": "emp_openai_codex_gpt5_codex",
  "profile_version": "1.1.0",
  "schema_version": "1.0.0",
  "executor_id": "exec_openai_codex",
  "provider_id": "openai-codex",
  "model_id": "gpt-5-codex",
  "execution_profile_ref": "profile_readonly_v1",
  "authority_grant": "none",
  "runtime_requirements": ["structured_output", "tool_calls"],
  "presentation": {
    "instruction_density": {
      "level": "balanced",
      "structure": "hierarchical",
      "max_directives": 40
    },
    "example_selection": {
      "mode": "representative",
      "count": 3,
      "include_failure_examples": true
    },
    "output_formatting": {
      "mode": "schema_bound",
      "structured_output": "native_schema",
      "require_explicit_json_instruction": false
    },
    "context_packaging": {
      "unit": "layered",
      "ordering": [
        "system_role",
        "constraints",
        "task",
        "examples",
        "tools",
        "output_contract",
        "context"
      ],
      "section_header_style": "delimiter",
      "system_channel": "system_role"
    },
    "tool_call_interface_requirements": {
      "call_style": "native_function_call",
      "argument_encoding": "schema_bound",
      "parallel_tool_calls": "allowed",
      "requires_tool_result_echo": true
    },
    "retry_strategy": {
      "max_attempts": 2,
      "on_ineffective_task": "replan",
      "backoff": "linear"
    }
  },
  "semantics_preservation": {
    "task_scope": "unchanged",
    "authority_ceiling": "unchanged",
    "tool_rights": "unchanged",
    "security_controls": "unchanged",
    "completion_criteria": "unchanged",
    "evidence_requirements": "unchanged",
    "pinned_dimensions": {
      "tool_contract_refs": ["core/contracts/tool-contracts/catalog.json"],
      "api_surface_version": "2026-10",
      "qualification_profile_ref": "qualprofile_model_adaptive_v1",
      "effective_instruction_digest": "sha256:ff53f1102a5c814d1c8c0a0544f8c617385953e071a70c9fa320c206d11b7952"
    }
  },
  "qualification": {
    "state": "PROPOSED",
    "evidence_refs": []
  },
  "provenance": {
    "source_refs": [
      "core/contracts/provider-capabilities.json",
      "core/contracts/execution-profile.schema.json",
      "core/contracts/executor-model-profile.schema.json",
      "docs/proposals/skill-intelligence-target-spec.md",
      "providers/openai-codex/export.json"
    ],
    "note": "Second presentation variant of the SAME model and executor. It differs from 1.0.0 in every optimizable dimension and binds the same execution profile, so the S12 DoD equivalence invariant is provable on committed data: identical authority and completion semantics, different presentation."
  }
}
