{
  "profile_id": "emp_openai_codex_gpt5_codex",
  "profile_version": "1.0.0",
  "schema_version": "1.0.0",
  "executor_id": "exec_openai_codex",
  "provider_id": "openai-codex",
  "model_id": "gpt-5-codex",
  "execution_profile_ref": "profile_readonly_v1",
  "authority_grant": "none",
  "runtime_requirements": ["structured_output", "tool_calls"],
  "presentation": {
    "instruction_density": {
      "level": "compact",
      "structure": "sectioned",
      "max_directives": 24
    },
    "example_selection": {
      "mode": "minimal",
      "count": 1,
      "include_failure_examples": false
    },
    "output_formatting": {
      "mode": "schema_bound",
      "structured_output": "native_schema",
      "require_explicit_json_instruction": false
    },
    "context_packaging": {
      "unit": "sectioned_blocks",
      "ordering": [
        "system_role",
        "task",
        "constraints",
        "tools",
        "output_contract",
        "context"
      ],
      "section_header_style": "markdown_heading",
      "system_channel": "system_role"
    },
    "tool_call_interface_requirements": {
      "call_style": "native_function_call",
      "argument_encoding": "schema_bound",
      "parallel_tool_calls": "allowed",
      "requires_tool_result_echo": true
    },
    "retry_strategy": {
      "max_attempts": 1,
      "on_ineffective_task": "escalate",
      "backoff": "none"
    }
  },
  "semantics_preservation": {
    "task_scope": "unchanged",
    "authority_ceiling": "unchanged",
    "tool_rights": "unchanged",
    "security_controls": "unchanged",
    "completion_criteria": "unchanged",
    "evidence_requirements": "unchanged",
    "pinned_dimensions": {
      "tool_contract_refs": ["core/contracts/tool-contracts/catalog.json"],
      "api_surface_version": "2026-10",
      "qualification_profile_ref": "qualprofile_model_adaptive_v1",
      "effective_instruction_digest": "sha256:c36f94a3b6794865524975a4458b057f89a22138b67cec95e9f7455a420c82e1"
    }
  },
  "qualification": {
    "state": "PROPOSED",
    "evidence_refs": []
  },
  "provenance": {
    "source_refs": [
      "core/contracts/provider-capabilities.json",
      "core/contracts/execution-profile.schema.json",
      "core/contracts/executor-model-profile.schema.json",
      "docs/proposals/skill-intelligence-target-spec.md",
      "providers/openai-codex/export.json"
    ],
    "note": "Presentation layer for the OpenAI-Codex native tool-use / native structured-output capability state. Qualification state is PROPOSED: representative-eval qualification (spec 11.5) is an open S12 item and this profile grants no authority."
  }
}
