{
  "profile_id": "emp_qwen_code_qwen3_max",
  "profile_version": "1.0.0",
  "schema_version": "1.0.0",
  "executor_id": "exec_qwen_code",
  "provider_id": "qwen-code",
  "model_id": "qwen3-max",
  "execution_profile_ref": "profile_readonly_v1",
  "authority_grant": "none",
  "runtime_requirements": ["structured_output", "tool_calls"],
  "presentation": {
    "instruction_density": {
      "level": "balanced",
      "structure": "hierarchical",
      "max_directives": 32
    },
    "example_selection": {
      "mode": "representative",
      "count": 2,
      "include_failure_examples": false
    },
    "output_formatting": {
      "mode": "schema_bound",
      "structured_output": "adapter_schema",
      "require_explicit_json_instruction": false
    },
    "context_packaging": {
      "unit": "sectioned_blocks",
      "ordering": [
        "system_role",
        "task",
        "constraints",
        "tools",
        "output_contract",
        "context"
      ],
      "section_header_style": "markdown_heading",
      "system_channel": "system_role"
    },
    "tool_call_interface_requirements": {
      "call_style": "native_function_call",
      "argument_encoding": "json_object",
      "parallel_tool_calls": "unspecified",
      "requires_tool_result_echo": true
    },
    "retry_strategy": {
      "max_attempts": 2,
      "on_ineffective_task": "replan",
      "backoff": "linear"
    }
  },
  "semantics_preservation": {
    "task_scope": "unchanged",
    "authority_ceiling": "unchanged",
    "tool_rights": "unchanged",
    "security_controls": "unchanged",
    "completion_criteria": "unchanged",
    "evidence_requirements": "unchanged",
    "pinned_dimensions": {
      "tool_contract_refs": ["core/contracts/tool-contracts/catalog.json"],
      "api_surface_version": "2026-10",
      "qualification_profile_ref": "qualprofile_model_adaptive_v1",
      "effective_instruction_digest": "sha256:6fb34ad009b1589066dd5233dbbab7a8e6b900c69f23754fd3f2664046db587c"
    }
  },
  "qualification": {
    "state": "PROPOSED",
    "evidence_refs": []
  },
  "provenance": {
    "source_refs": [
      "core/contracts/provider-capabilities.json",
      "core/contracts/execution-profile.schema.json",
      "core/contracts/executor-model-profile.schema.json",
      "docs/proposals/skill-intelligence-target-spec.md",
      "providers/qwen-code/export.json"
    ],
    "note": "Presentation layer for the Qwen-Code native tool-use / adapter structured-output capability state. Qualification state is PROPOSED; this profile grants no authority."
  }
}
